question,user_and_task
What overarching technology trends are reflected across different news sectors?,"{'user': 'Journalist analyzing trends in various sectors.', 'task': 'Identify emerging technology trends across multiple sectors'}"
What patterns emerge in consumer engagement across entertainment and sports sectors?,"{'user': 'Journalist analyzing trends in various sectors.', 'task': 'Analyze shifts in consumer behavior within entertainment and sports'}"
What overarching trends in health advancements are highlighted across the dataset?,"{'user': 'Journalist analyzing trends in various sectors.', 'task': 'Compare health advancements reported in different articles'}"
What recent business developments most influenced global market trends?,"{'user': 'Journalist analyzing trends in various sectors.', 'task': 'Explore the impact of recent business developments on global markets'}"
What trends emerge in public perception across different news sectors?,"{'user': 'Journalist analyzing trends in various sectors.', 'task': 'Synthesize cultural phenomena insights from diverse news pieces'}"
What common themes emerge in corporate strategies across various industries?,"{'user': 'Business analyst assessing market and regulatory changes.', 'task': 'Analyze trends in corporate strategies across industries'}"
"What regulatory changes are emerging across technology, business, and health sectors?","{'user': 'Business analyst assessing market and regulatory changes.', 'task': 'Examine regulatory changes affecting different sectors'}"
What emerging technologies are influencing market dynamics across various sectors?,"{'user': 'Business analyst assessing market and regulatory changes.', 'task': 'Identify market shifts in response to emerging technologies'}"
What global trends are evident in health-related business developments?,"{'user': 'Business analyst assessing market and regulatory changes.', 'task': 'Compare health-related business developments globally'}"
How do cultural phenomena influence economic trends in various sectors?,"{'user': 'Business analyst assessing market and regulatory changes.', 'task': 'Connect cultural phenomena with economic changes'}"
What global trends in public wellness are highlighted across diverse articles?,"{'user': 'Health researcher monitoring public wellness topics.', 'task': 'Analyze trends in public wellness across multiple regions.'}"
What trends in technology can impact public health perceptions globally?,"{'user': 'Health researcher monitoring public wellness topics.', 'task': 'Compare health impacts of new technologies reported in articles.'}"
What are the dominant themes in health-related articles over the past year?,"{'user': 'Health researcher monitoring public wellness topics.', 'task': 'Identify recurring topics in health-related articles over time.'}"
How do economic developments impact public health strategies globally?,"{'user': 'Health researcher monitoring public wellness topics.', 'task': 'Evaluate the intersection of public health and economic developments.'}"
How do global trends in health research influence public policy responses worldwide?,"{'user': 'Health researcher monitoring public wellness topics.', 'task': 'Synthesize findings on medical research and public policy responses.'}"
What are the prevailing themes in emerging technology discussions across articles?,"{'user': 'Technology enthusiast tracking emerging innovations.', 'task': 'Identify trends in emerging technology discussions.'}"
How do different technological breakthroughs impact various sectors globally?,"{'user': 'Technology enthusiast tracking emerging innovations.', 'task': 'Compare breakthroughs across different technological domains.'}"
How are technological advancements reshaping public health strategies globally?,"{'user': 'Technology enthusiast tracking emerging innovations.', 'task': 'Analyze the impact of technology on health and wellness.'}"
How do advancements in technology influence business strategies and market shifts?,"{'user': 'Technology enthusiast tracking emerging innovations.', 'task': 'Explore interconnections between tech and business developments.'}"
How do cultural perceptions of technology impact its adoption and innovation?,"{'user': 'Technology enthusiast tracking emerging innovations.', 'task': 'Review cultural responses to technological innovations.'}"
What overarching themes emerge in technology and pop culture articles over time?,"{'user': 'Cultural critic evaluating media and pop culture shifts.', 'task': 'Analyze trends in technology and pop culture articles'}"
What trends in public perception of health are evident in recent articles?,"{'user': 'Cultural critic evaluating media and pop culture shifts.', 'task': 'Identify shifts in public perception of health topics'}"
How is the portrayal of major sporting events evolving across different media platforms?,"{'user': 'Cultural critic evaluating media and pop culture shifts.', 'task': 'Compare coverage of sporting events across different media'}"
What corporate strategies are shaping the future of the entertainment industry?,"{'user': 'Cultural critic evaluating media and pop culture shifts.', 'task': 'Explore corporate strategies impacting entertainment sectors'}"
What trends in technology coverage reveal societal attitudes toward innovation?,"{'user': 'Cultural critic evaluating media and pop culture shifts.', 'task': 'Assess cultural phenomena reflected in recent news stories'}"
How are emerging technologies influencing global economic and social landscapes?,"{'user': 'Journalist analyzing trends in various sectors.', 'task': 'Identify emerging technology trends across multiple sectors'}"
How do cultural phenomena influence trends in consumer preferences within these industries?,"{'user': 'Journalist analyzing trends in various sectors.', 'task': 'Analyze shifts in consumer behavior within entertainment and sports'}"
How do health advancements differ between regions as reported in the articles?,"{'user': 'Journalist analyzing trends in various sectors.', 'task': 'Compare health advancements reported in different articles'}"
How do technology advancements impact the business landscape globally?,"{'user': 'Journalist analyzing trends in various sectors.', 'task': 'Explore the impact of recent business developments on global markets'}"
How do cultural phenomena influence consumer behavior in technology and entertainment?,"{'user': 'Journalist analyzing trends in various sectors.', 'task': 'Synthesize cultural phenomena insights from diverse news pieces'}"
How do regulatory changes influence corporate decision-making globally?,"{'user': 'Business analyst assessing market and regulatory changes.', 'task': 'Analyze trends in corporate strategies across industries'}"
How do global markets respond to regulatory shifts in various industries?,"{'user': 'Business analyst assessing market and regulatory changes.', 'task': 'Examine regulatory changes affecting different sectors'}"
How do regulatory changes impact the adoption of new technologies in business?,"{'user': 'Business analyst assessing market and regulatory changes.', 'task': 'Identify market shifts in response to emerging technologies'}"
How do regulatory changes impact health sectors across different countries?,"{'user': 'Business analyst assessing market and regulatory changes.', 'task': 'Compare health-related business developments globally'}"
What common themes link technology advancements to market shifts?,"{'user': 'Business analyst assessing market and regulatory changes.', 'task': 'Connect cultural phenomena with economic changes'}"
How do various regions respond differently to public wellness challenges?,"{'user': 'Health researcher monitoring public wellness topics.', 'task': 'Analyze trends in public wellness across multiple regions.'}"
How do reported health effects of technology vary across different regions?,"{'user': 'Health researcher monitoring public wellness topics.', 'task': 'Compare health impacts of new technologies reported in articles.'}"
How have public wellness topics evolved in response to global health events?,"{'user': 'Health researcher monitoring public wellness topics.', 'task': 'Identify recurring topics in health-related articles over time.'}"
What trends in public wellness are reflected through economic news coverage?,"{'user': 'Health researcher monitoring public wellness topics.', 'task': 'Evaluate the intersection of public health and economic developments.'}"
What common themes emerge in articles discussing health and wellness topics?,"{'user': 'Health researcher monitoring public wellness topics.', 'task': 'Synthesize findings on medical research and public policy responses.'}"
How do technology trends correlate with economic and social changes in coverage?,"{'user': 'Technology enthusiast tracking emerging innovations.', 'task': 'Identify trends in emerging technology discussions.'}"
What trends do recent innovations show across technology and business fields?,"{'user': 'Technology enthusiast tracking emerging innovations.', 'task': 'Compare breakthroughs across different technological domains.'}"
What role does innovation play in addressing mental health challenges in society?,"{'user': 'Technology enthusiast tracking emerging innovations.', 'task': 'Analyze the impact of technology on health and wellness.'}"
What role does popular culture play in shaping technological innovations?,"{'user': 'Technology enthusiast tracking emerging innovations.', 'task': 'Explore interconnections between tech and business developments.'}"
What trends emerge in public responses to significant technological breakthroughs?,"{'user': 'Technology enthusiast tracking emerging innovations.', 'task': 'Review cultural responses to technological innovations.'}"
How do technology advancements influence shifts in popular culture narratives?,"{'user': 'Cultural critic evaluating media and pop culture shifts.', 'task': 'Analyze trends in technology and pop culture articles'}"
How do different topics influence public understanding of health issues?,"{'user': 'Cultural critic evaluating media and pop culture shifts.', 'task': 'Identify shifts in public perception of health topics'}"
What trends can be identified in the coverage of sports compared to other topics?,"{'user': 'Cultural critic evaluating media and pop culture shifts.', 'task': 'Compare coverage of sporting events across different media'}"
How are technology advancements influencing entertainment consumption patterns worldwide?,"{'user': 'Cultural critic evaluating media and pop culture shifts.', 'task': 'Explore corporate strategies impacting entertainment sectors'}"
How do entertainment articles reflect changing cultural norms and values?,"{'user': 'Cultural critic evaluating media and pop culture shifts.', 'task': 'Assess cultural phenomena reflected in recent news stories'}"
